{
  "schema_version": "7.0",
  "artifact_type": "kristall_source_registry",
  "namespace_id": "kristall-main",
  "registry_id": "urn:kristall:registry:sources",
  "sources": [
    {
      "source_id": "KS1",
      "title": "Formal powers source Kristal",
      "source_type": "kristal_state",
      "status": "active",
      "source_bindings": [
        {
          "source_kristal_id": "urn:kristal:power-formal"
        }
      ]
    },
    {
      "source_id": "KS2",
      "title": "Informal powers source Kristal",
      "source_type": "kristal_state",
      "status": "active",
      "source_bindings": [
        {
          "source_kristal_id": "urn:kristal:power-informal"
        }
      ]
    }
  ]
}
